{
  "schema_version": 1,
  "packet_id": "FSCI-P2C-007",
  "domain": "integrate",
  "generated_at": "2026-02-14T00:00:00Z",
  "entries": [
    {
      "scipy_module": "scipy.integrate._ivp.ivp",
      "key_functions": ["solve_ivp", "prepare_events", "solve_event_equation", "handle_events", "find_active_events"],
      "behavior_summary": "Main entry point for initial value problem solving. Accepts a callable RHS, 2-element t_span, initial state y0, and dispatches to one of six solver classes (RK23, RK45, DOP853, Radau, BDF, LSODA) by string name or OdeSolver subclass. Manages the stepping loop, dense output collection, event detection via sign-change + Brent root-finding, and t_eval interpolation. Returns an OdeResult bunch with t, y, sol, t_events, y_events, nfev, njev, nlu, status, message, success fields. Events support terminal (bool or positive int for max count) and direction (+1/-1/0) attributes. The function wraps user fun/jac with args if provided. t_eval values must be sorted consistently with integration direction and lie within t_span.",
      "rust_strategy": "Implement solve_ivp as a generic orchestrator parameterized by a SolverKind enum. Use trait objects or an enum dispatch for the solver polymorphism. The stepping loop, event detection, and dense output collection translate directly. OdeResult maps to a Rust struct. Event root-finding uses Brent's method from a local implementation (no Fortran dependency). The args-wrapping pattern becomes a closure capture. t_eval handling uses binary search (equivalent to np.searchsorted).",
      "risk_level": "high",
      "legacy_paths": ["scipy/integrate/_ivp/ivp.py"],
      "semantic_hotspots": [
        "Method dispatch: string name -> class lookup from METHODS dict, or arbitrary OdeSolver subclass",
        "t_span is converted to (float, float) via map(float, t_span) -- NaN/Inf not explicitly rejected here",
        "t_eval validation: must be 1-D, within [min(t0,tf), max(t0,tf)], sorted consistently with direction",
        "t_eval is reversed internally when tf < t0 for searchsorted compatibility",
        "Event detection uses sign-change between steps: can miss multiple zero crossings within a single step",
        "Terminal events: terminal attribute can be bool (True = stop after 1) or positive int (stop after N occurrences)",
        "args wrapping uses late-binding closure with default kwarg trick to avoid closure gotcha",
        "Dense output alt_segment=True for BDF and LSODA, False for all others",
        "When t_eval is given with dense_output, ts stores solver timepoints in separate 'ti' list for OdeSolution construction",
        "Status codes: -1 (failed), 0 (success), 1 (terminal event)",
        "Empty t_eval results in ts=[], ys=[] -- hstack will produce empty arrays"
      ]
    },
    {
      "scipy_module": "scipy.integrate._ivp.base",
      "key_functions": ["OdeSolver", "OdeSolver.__init__", "OdeSolver.step", "OdeSolver.dense_output", "DenseOutput", "ConstantDenseOutput", "check_arguments"],
      "behavior_summary": "OdeSolver is the abstract base for all IVP solvers. Constructor validates y0 (must be 1-D, finite, cast to float or complex), wraps fun for nfev counting, sets up vectorized/non-vectorized variants, computes direction=sign(t_bound-t0) (or 1 if equal), initializes counters. The step() method calls _step_impl(), updates status to 'finished' when direction*(t-t_bound)>=0, or 'failed' on unsuccessful step. Corner cases: n==0 (empty system) or t==t_bound immediately finishes. dense_output() requires at least one successful step (t_old != None). DenseOutput base stores t_old, t, t_min, t_max and validates t dimensionality. ConstantDenseOutput returns the constant value for degenerate cases.",
      "rust_strategy": "Define an OdeSolver trait with step_impl() and dense_output_impl() methods. The base state (t, y, t_old, t_bound, direction, nfev, njev, nlu, status) goes into a common struct composed into each solver. The fun-wrapping logic (vectorized vs single) becomes trait-based dispatch. check_arguments becomes a validation function returning Result<(WrappedFun, Array1<f64>), Error>.",
      "risk_level": "medium",
      "legacy_paths": ["scipy/integrate/_ivp/base.py"],
      "semantic_hotspots": [
        "y0 must be 1-D ndarray; multi-dimensional y0 raises ValueError",
        "y0 must have all finite components; NaN or Inf raises ValueError",
        "Complex y0 requires support_complex=True from solver, else ValueError",
        "direction = sign(t_bound - t0), but if t_bound == t0, direction = 1 (not 0)",
        "fun wrapper increments nfev per call to fun_single (NOT fun_vectorized)",
        "step_size property returns None before any step, else abs(t - t_old)",
        "step() raises RuntimeError if status != 'running'",
        "Empty system (n==0) immediately finishes with no function evaluations",
        "When t==t_bound, step() immediately finishes (zero-length integration)"
      ]
    },
    {
      "scipy_module": "scipy.integrate._ivp.rk",
      "key_functions": ["RungeKutta", "RK23", "RK45", "DOP853", "rk_step", "RkDenseOutput", "Dop853DenseOutput"],
      "behavior_summary": "Explicit Runge-Kutta solvers. RungeKutta base constructor validates max_step (>0), tolerances, selects initial step (automatic or user-provided), allocates K storage. Step implementation uses adaptive step size control: SAFETY=0.9, MIN_FACTOR=0.2, MAX_FACTOR=10. Error norm < 1 accepts step; error_norm==0 gives MAX_FACTOR growth. After rejection, growth factor capped at 1. Minimum step size is 10*ULP(t). RK23: Bogacki-Shampine order 3(2), 3 stages. RK45: Dormand-Prince order 5(4), 6 stages. DOP853: order 8, 12 stages with extended 16 stages for dense output; uses dual error estimators E3 and E5 with hypot-based combination. All support complex domain. Dense output: RK23/RK45 use polynomial interpolation via Q=K^T*P; DOP853 uses 7th-order Aitken-Neville like scheme with F coefficients.",
      "rust_strategy": "Implement RungeKutta as a generic struct parameterized by Butcher tableau constants (compile-time arrays or const generics where possible). RK23/RK45/DOP853 become type aliases or specific instantiations. The step loop with adaptive step control translates directly. Dense output interpolants become separate structs implementing a DenseOutput trait. DOP853's extended stages and dual error estimator need careful porting. FSAL (first-same-as-last) property is implicit in rk_step where K[-1]=f_new.",
      "risk_level": "high",
      "legacy_paths": ["scipy/integrate/_ivp/rk.py", "scipy/integrate/_ivp/dop853_coefficients.py"],
      "semantic_hotspots": [
        "FSAL property: K[0]=f (current derivative), K[-1]=f_new (reused as next K[0])",
        "Error scale uses max(|y|, |y_new|) * rtol + atol, NOT just |y|",
        "min_step = 10 * |nextafter(t, direction*inf) - t| (10 ULPs)",
        "After step rejection, next growth factor is min(1, factor) -- no growth after rejection",
        "DOP853 error norm uses combined E3 and E5: denom = err5_norm^2 + 0.01*err3_norm^2",
        "DOP853 dense output requires 4 additional function evaluations (stages 13-16)",
        "RK45 has 7 error coefficients E (for 7 stages including FSAL), not 6",
        "All RK methods pass support_complex=True to OdeSolver base"
      ]
    },
    {
      "scipy_module": "scipy.integrate._ivp.radau",
      "key_functions": ["Radau", "solve_collocation_system", "predict_factor", "RadauDenseOutput"],
      "behavior_summary": "Implicit Runge-Kutta method of Radau IIA family, order 5, with 3 stages. Uses eigendecomposition of Butcher matrix A=T*L*T^-1 to decouple the collocation system into one real and one complex linear system. Newton iterations (max 6) solve the collocation system with convergence check on rate and projected error. Jacobian can be constant (array), callable, or finite-difference approximated. Supports sparse Jacobians via splu. Step size prediction uses two-step algorithm (Hairer-Wanner). Newton tolerance is max(10*EPS/rtol, min(0.03, sqrt(rtol))). LU decomposition dispatch: dense uses scipy.linalg.lu_factor/lu_solve, sparse uses scipy.sparse.linalg.splu. Does NOT pass support_complex to base (complex domain not supported by Radau).",
      "rust_strategy": "Port the collocation system solver with the T/TI transformation matrices as constants. The Newton iteration loop translates directly. LU decomposition dispatch: use nalgebra's LU for dense, and a sparse LU crate for sparse. The Jacobian validation pattern (None/callable/array) maps to a Rust enum. The predict_factor two-step algorithm is pure arithmetic. Key challenge: complex arithmetic for MU_COMPLEX and the complex LU solve.",
      "risk_level": "critical",
      "legacy_paths": ["scipy/integrate/_ivp/radau.py"],
      "semantic_hotspots": [
        "Radau does NOT support complex domain (no support_complex=True passed to base)",
        "Initial step selection uses order=3 (error estimator order), not order=5 (method order)",
        "Newton tolerance formula: max(10*EPS/rtol, min(0.03, sqrt(rtol)))",
        "NEWTON_MAXITER = 6 for Radau (vs 4 for BDF)",
        "Convergence check: rate >= 1 or projected error rate^(MAXITER-k)/(1-rate)*norm > tol",
        "If Newton fails with current Jacobian, recompute Jacobian and retry; if still fails, halve step",
        "After step acceptance: recompute_jac if jac is not None AND n_iter > 2 AND rate > 1e-3",
        "Safety factor: 0.9 * (2*MAXITER+1) / (2*MAXITER+n_iter)",
        "Error computed by solving LU_real * error = f + Z^T*E/h (NOT direct error estimation)",
        "If rejected AND error_norm > 1, does a second error estimation with fun(t, y+error)",
        "Dense output computed after EVERY successful step (sol stored on self), not on demand",
        "MU_REAL = 3 + 3^(2/3) - 3^(1/3) approximately 3.637834",
        "MU_COMPLEX has both real and imaginary parts from cube root decomposition",